{
  "slug": "newsletter-sponsorship-finder",
  "category": "capabilities",
  "tags": [
    "monitoring"
  ],
  "installation": {
    "base_command": "npx github:edupegoretti/fluidz-skills install newsletter-sponsorship-finder",
    "supports": [
      "claude",
      "cursor",
      "codex"
    ]
  }
}
