{
  "slug": "competitive-pricing-intel",
  "category": "composites",
  "tags": [
    "competitive-intel"
  ],
  "installation": {
    "base_command": "npx github:edupegoretti/fluidz-skills install competitive-pricing-intel",
    "supports": [
      "claude",
      "cursor",
      "codex"
    ]
  }
}
