{
  "slug": "inbound-lead-qualification",
  "category": "composites",
  "tags": [
    "lead-generation"
  ],
  "installation": {
    "base_command": "npx github:edupegoretti/fluidz-skills install inbound-lead-qualification",
    "supports": [
      "claude",
      "cursor",
      "codex"
    ]
  }
}
