{
  "slug": "competitor-content-tracker",
  "category": "composites",
  "tags": [
    "competitive-intel"
  ],
  "installation": {
    "base_command": "npx github:edupegoretti/fluidz-skills install competitor-content-tracker",
    "supports": [
      "claude",
      "cursor",
      "codex"
    ]
  }
}
