{
  "slug": "voice-of-customer-synthesizer",
  "category": "composites",
  "tags": [
    "research"
  ],
  "installation": {
    "base_command": "npx github:edupegoretti/fluidz-skills install voice-of-customer-synthesizer",
    "supports": [
      "claude",
      "cursor",
      "codex"
    ]
  }
}
