{
  "slug": "company-current-gtm-analysis",
  "category": "composites",
  "tags": [
    "competitive-intel"
  ],
  "installation": {
    "base_command": "npx github:edupegoretti/fluidz-skills install company-current-gtm-analysis",
    "supports": [
      "claude",
      "cursor",
      "codex"
    ]
  }
}
