{
  "slug": "linkedin-influencer-discovery",
  "category": "capabilities",
  "tags": [
    "outreach"
  ],
  "installation": {
    "base_command": "npx github:edupegoretti/fluidz-skills install linkedin-influencer-discovery",
    "supports": [
      "claude",
      "cursor",
      "codex"
    ]
  }
}
