{
  "slug": "job-posting-intent",
  "category": "capabilities",
  "tags": [
    "lead-generation",
    "outreach"
  ],
  "installation": {
    "base_command": "npx github:edupegoretti/fluidz-skills install job-posting-intent",
    "supports": [
      "claude",
      "cursor",
      "codex"
    ]
  }
}
