{
  "slug": "competitor-monitoring-system",
  "category": "playbooks",
  "tags": [
    "competitive-intel"
  ],
  "installation": {
    "base_command": "npx github:edupegoretti/fluidz-skills install competitor-monitoring-system",
    "supports": [
      "claude",
      "cursor",
      "codex"
    ]
  }
}
